{
  "entries": [
    {
      "is_empty_target": false,
      "pointer_entry_file_offset": 901881,
      "pointer_expression": "OverworldData_HiddenItems_Screen_00",
      "source_line": 1870,
      "source_revision": "347c23f9fc019c72d32da537c9cb235f468d021d",
      "table_index": 0,
      "target_addend": null,
      "target_label": "OverworldData_HiddenItems_Screen_00"
    },
    {
      "is_empty_target": false,
      "pointer_entry_file_offset": 901883,
      "pointer_expression": "OverworldData_HiddenItems_Screen_00",
      "source_line": 1871,
      "source_revision": "347c23f9fc019c72d32da537c9cb235f468d021d",
      "table_index": 1,
      "target_addend": null,
      "target_label": "OverworldData_HiddenItems_Screen_00"
    },
    {
      "is_empty_target": false,
      "pointer_entry_file_offset": 901885,
      "pointer_expression": "OverworldData_HiddenItems_Screen_02",
      "source_line": 1872,
      "source_revision": "347c23f9fc019c72d32da537c9cb235f468d021d",
      "table_index": 2,
      "target_addend": null,
      "target_label": "OverworldData_HiddenItems_Screen_02"
    },
    {
      "is_empty_target": false,
      "pointer_entry_file_offset": 901887,
      "pointer_expression": "OverworldData_HiddenItems_Screen_03",
      "source_line": 1873,
      "source_revision": "347c23f9fc019c72d32da537c9cb235f468d021d",
      "table_index": 3,
      "target_addend": null,
      "target_label": "OverworldData_HiddenItems_Screen_03"
    },
    {
      "is_empty_target": false,
      "pointer_entry_file_offset": 901889,
      "pointer_expression": "OverworldData_HiddenItems_Screen_03",
      "source_line": 1874,
      "source_revision": "347c23f9fc019c72d32da537c9cb235f468d021d",
      "table_index": 4,
      "target_addend": null,
      "target_label": "OverworldData_HiddenItems_Screen_03"
    },
    {
      "is_empty_target": false,
      "pointer_entry_file_offset": 901891,
      "pointer_expression": "OverworldData_HiddenItems_Screen_05",
      "source_line": 1875,
      "source_revision": "347c23f9fc019c72d32da537c9cb235f468d021d",
      "table_index": 5,
      "target_addend": null,
      "target_label": "OverworldData_HiddenItems_Screen_05"
    },
    {
      "is_empty_target": false,
      "pointer_entry_file_offset": 901893,
      "pointer_expression": "OverworldData_HiddenItems_Screen_05",
      "source_line": 1876,
      "source_revision": "347c23f9fc019c72d32da537c9cb235f468d021d",
      "table_index": 6,
      "target_addend": null,
      "target_label": "OverworldData_HiddenItems_Screen_05"
    },
    {
      "is_empty_target": false,
      "pointer_entry_file_offset": 901895,
      "pointer_expression": "OverworldData_HiddenItems_Screen_07",
      "source_line": 1877,
      "source_revision": "347c23f9fc019c72d32da537c9cb235f468d021d",
      "table_index": 7,
      "target_addend": null,
      "target_label": "OverworldData_HiddenItems_Screen_07"
    },
    {
      "is_empty_target": false,
      "pointer_entry_file_offset": 901897,
      "pointer_expression": "OverworldData_HiddenItems_Screen_00",
      "source_line": 1878,
      "source_revision": "347c23f9fc019c72d32da537c9cb235f468d021d",
      "table_index": 8,
      "target_addend": null,
      "target_label": "OverworldData_HiddenItems_Screen_00"
    },
    {
      "is_empty_target": false,
      "pointer_entry_file_offset": 901899,
      "pointer_expression": "OverworldData_HiddenItems_Screen_00",
      "source_line": 1879,
      "source_revision": "347c23f9fc019c72d32da537c9cb235f468d021d",
      "table_index": 9,
      "target_addend": null,
      "target_label": "OverworldData_HiddenItems_Screen_00"
    },
    {
      "is_empty_target": false,
      "pointer_entry_file_offset": 901901,
      "pointer_expression": "OverworldData_HiddenItems_Screen_0A",
      "source_line": 1880,
      "source_revision": "347c23f9fc019c72d32da537c9cb235f468d021d",
      "table_index": 10,
      "target_addend": null,
      "target_label": "OverworldData_HiddenItems_Screen_0A"
    },
    {
      "is_empty_target": false,
      "pointer_entry_file_offset": 901903,
      "pointer_expression": "OverworldData_HiddenItems_Screen_03",
      "source_line": 1881,
      "source_revision": "347c23f9fc019c72d32da537c9cb235f468d021d",
      "table_index": 11,
      "target_addend": null,
      "target_label": "OverworldData_HiddenItems_Screen_03"
    },
    {
      "is_empty_target": false,
      "pointer_entry_file_offset": 901905,
      "pointer_expression": "OverworldData_HiddenItems_Screen_03",
      "source_line": 1882,
      "source_revision": "347c23f9fc019c72d32da537c9cb235f468d021d",
      "table_index": 12,
      "target_addend": null,
      "target_label": "OverworldData_HiddenItems_Screen_03"
    },
    {
      "is_empty_target": false,
      "pointer_entry_file_offset": 901907,
      "pointer_expression": "OverworldData_HiddenItems_Screen_05",
      "source_line": 1883,
      "source_revision": "347c23f9fc019c72d32da537c9cb235f468d021d",
      "table_index": 13,
      "target_addend": null,
      "target_label": "OverworldData_HiddenItems_Screen_05"
    },
    {
      "is_empty_target": false,
      "pointer_entry_file_offset": 901909,
      "pointer_expression": "OverworldData_HiddenItems_Screen_05",
      "source_line": 1884,
      "source_revision": "347c23f9fc019c72d32da537c9cb235f468d021d",
      "table_index": 14,
      "target_addend": null,
      "target_label": "OverworldData_HiddenItems_Screen_05"
    },
    {
      "is_empty_target": false,
      "pointer_entry_file_offset": 901911,
      "pointer_expression": "OverworldData_HiddenItems_Screen_0F",
      "source_line": 1885,
      "source_revision": "347c23f9fc019c72d32da537c9cb235f468d021d",
      "table_index": 15,
      "target_addend": null,
      "target_label": "OverworldData_HiddenItems_Screen_0F"
    },
    {
      "is_empty_target": false,
      "pointer_entry_file_offset": 901913,
      "pointer_expression": "OverworldData_HiddenItems_Screen_10",
      "source_line": 1886,
      "source_revision": "347c23f9fc019c72d32da537c9cb235f468d021d",
      "table_index": 16,
      "target_addend": null,
      "target_label": "OverworldData_HiddenItems_Screen_10"
    },
    {
      "is_empty_target": false,
      "pointer_entry_file_offset": 901915,
      "pointer_expression": "OverworldData_HiddenItems_Screen_11",
      "source_line": 1887,
      "source_revision": "347c23f9fc019c72d32da537c9cb235f468d021d",
      "table_index": 17,
      "target_addend": null,
      "target_label": "OverworldData_HiddenItems_Screen_11"
    },
    {
      "is_empty_target": false,
      "pointer_entry_file_offset": 901917,
      "pointer_expression": "OverworldData_HiddenItems_Screen_12",
      "source_line": 1888,
      "source_revision": "347c23f9fc019c72d32da537c9cb235f468d021d",
      "table_index": 18,
      "target_addend": null,
      "target_label": "OverworldData_HiddenItems_Screen_12"
    },
    {
      "is_empty_target": false,
      "pointer_entry_file_offset": 901919,
      "pointer_expression": "OverworldData_HiddenItems_Screen_13",
      "source_line": 1889,
      "source_revision": "347c23f9fc019c72d32da537c9cb235f468d021d",
      "table_index": 19,
      "target_addend": null,
      "target_label": "OverworldData_HiddenItems_Screen_13"
    },
    {
      "is_empty_target": false,
      "pointer_entry_file_offset": 901921,
      "pointer_expression": "OverworldData_HiddenItems_Screen_14",
      "source_line": 1890,
      "source_revision": "347c23f9fc019c72d32da537c9cb235f468d021d",
      "table_index": 20,
      "target_addend": null,
      "target_label": "OverworldData_HiddenItems_Screen_14"
    },
    {
      "is_empty_target": false,
      "pointer_entry_file_offset": 901923,
      "pointer_expression": "OverworldData_HiddenItems_Screen_15",
      "source_line": 1891,
      "source_revision": "347c23f9fc019c72d32da537c9cb235f468d021d",
      "table_index": 21,
      "target_addend": null,
      "target_label": "OverworldData_HiddenItems_Screen_15"
    },
    {
      "is_empty_target": false,
      "pointer_entry_file_offset": 901925,
      "pointer_expression": "OverworldData_HiddenItems_Screen_16",
      "source_line": 1892,
      "source_revision": "347c23f9fc019c72d32da537c9cb235f468d021d",
      "table_index": 22,
      "target_addend": null,
      "target_label": "OverworldData_HiddenItems_Screen_16"
    },
    {
      "is_empty_target": false,
      "pointer_entry_file_offset": 901927,
      "pointer_expression": "OverworldData_HiddenItems_Screen_17",
      "source_line": 1893,
      "source_revision": "347c23f9fc019c72d32da537c9cb235f468d021d",
      "table_index": 23,
      "target_addend": null,
      "target_label": "OverworldData_HiddenItems_Screen_17"
    },
    {
      "is_empty_target": false,
      "pointer_entry_file_offset": 901929,
      "pointer_expression": "OverworldData_HiddenItems_Screen_18",
      "source_line": 1894,
      "source_revision": "347c23f9fc019c72d32da537c9cb235f468d021d",
      "table_index": 24,
      "target_addend": null,
      "target_label": "OverworldData_HiddenItems_Screen_18"
    },
    {
      "is_empty_target": false,
      "pointer_entry_file_offset": 901931,
      "pointer_expression": "OverworldData_HiddenItems_Screen_18",
      "source_line": 1895,
      "source_revision": "347c23f9fc019c72d32da537c9cb235f468d021d",
      "table_index": 25,
      "target_addend": null,
      "target_label": "OverworldData_HiddenItems_Screen_18"
    },
    {
      "is_empty_target": false,
      "pointer_entry_file_offset": 901933,
      "pointer_expression": "OverworldData_HiddenItems_Screen_1A",
      "source_line": 1896,
      "source_revision": "347c23f9fc019c72d32da537c9cb235f468d021d",
      "table_index": 26,
      "target_addend": null,
      "target_label": "OverworldData_HiddenItems_Screen_1A"
    },
    {
      "is_empty_target": false,
      "pointer_entry_file_offset": 901935,